{
  "schemaVersion": 1,
  "status": "frozen",
  "baseRevision": "d194be4cb8f89f37d4ba7f05d17e16f9bed055ee",
  "algorithmRevision": 6,
  "features": [
    "COH-F052",
    "COH-F011",
    "COH-F012",
    "COH-F013",
    "COH-F049",
    "COH-F044",
    "COH-F003",
    "COH-F023"
  ],
  "baseline": {
    "worlds": [
      "ash-strata",
      "crystal-fibre",
      "ivory-basin",
      "cinder-ridge",
      "pallid-membrane",
      "silt-gel",
      "schist-shear",
      "splayed-fibres",
      "shell-chain",
      "grain-laminate",
      "tension-membrane",
      "shell-gel-delta",
      "pressed-dunes",
      "ruptured-film",
      "reversed-flow",
      "laminate-shell",
      "fibre-silt",
      "film-laminate",
      "gel-fibre",
      "shell-grit",
      "rib-vault",
      "pleated-hide",
      "blister-field",
      "wax-tongues",
      "monolith-sill",
      "bleached-court",
      "split-rib-causeway",
      "satin-fan",
      "chalk-steps",
      "porcelain-maw",
      "amber-ribs",
      "pale-sail",
      "root-cistern",
      "scab-islands",
      "foam-trenches",
      "resin-fall",
      "tendon-shelves",
      "felt-basin",
      "cork-shelves",
      "lacquer-court",
      "ribbed-delta",
      "bladder-weave",
      "flake-thicket",
      "resin-hollows",
      "sentinel-mass",
      "stepped-bowl",
      "draped-bay",
      "ember-cushions",
      "splinter-rotunda",
      "quilted-scars",
      "silt-colonnade",
      "shell-causeway"
    ],
    "packages": {
      "path": "docs/qa/artifacts/r100-i07-i09/final-packages/index.json",
      "sha256": "a038a38d0c658df18a5cfa9387d282bf1343dc032a9883344f235dab25ca65a6"
    },
    "source": {
      "path": "docs/qa/artifacts/r100-i07-i09/final-source/source-snapshot.json",
      "sha256": "803db74579cea533c0c50f93c35d32c7026aa15e3787b9e3703f5a0d4c1c1b04"
    },
    "qualifiedSeedsPerGrade": 48,
    "fixedPlayProcesses": 312
  },
  "grades": [
    "low",
    "medium",
    "severe"
  ],
  "batches": [
    {
      "id": "B01",
      "iteration": "R100-I10",
      "capacity": 4,
      "status": "specified",
      "worlds": [
        "cleft-tableland",
        "fallen-spines",
        "clamped-shore",
        "torn-reservoir"
      ]
    },
    {
      "id": "B02",
      "iteration": "R100-I10",
      "capacity": 4,
      "status": "specified",
      "worlds": [
        "braided-seam",
        "scalloped-reach",
        "offset-pan",
        "thin-delta"
      ]
    },
    {
      "id": "B03",
      "iteration": "R100-I10",
      "capacity": 4,
      "status": "specified",
      "worlds": [
        "shard-switchback",
        "hollow-wreckage",
        "knotted-run",
        "rolled-fragments"
      ]
    },
    {
      "id": "B04",
      "iteration": "R100-I10",
      "capacity": 4,
      "status": "specified",
      "worlds": [
        "fibre-choke",
        "buried-lamellae",
        "pressed-rim",
        "wedged-hide"
      ]
    },
    {
      "id": "B05",
      "iteration": "R100-I10",
      "capacity": 4,
      "status": "specified",
      "worlds": [
        "quiet-spur",
        "split-fall",
        "three-shelves",
        "frayed-outwash"
      ]
    },
    {
      "id": "B06",
      "iteration": "R100-I11",
      "capacity": 4,
      "status": "specified",
      "worlds": [
        "short-fibre-mat",
        "marrow-break",
        "felt-wedges",
        "pore-bank"
      ]
    },
    {
      "id": "B07",
      "iteration": "R100-I11",
      "capacity": 4,
      "status": "specified",
      "worlds": [
        "staggered-cups",
        "split-tows",
        "curled-flats",
        "pitch-forks"
      ]
    },
    {
      "id": "B08",
      "iteration": "R100-I11",
      "capacity": 4,
      "status": "specified",
      "worlds": [
        "grain-weld",
        "silk-catch",
        "resin-sleeve",
        "shell-threads"
      ]
    },
    {
      "id": "B09",
      "iteration": "R100-I11",
      "capacity": 4,
      "status": "specified",
      "worlds": [
        "chalk-divide",
        "red-vault-fragments",
        "blue-fault",
        "pale-pressure"
      ]
    },
    {
      "id": "B10",
      "iteration": "R100-I11",
      "capacity": 4,
      "status": "specified",
      "worlds": [
        "notched-backwater",
        "crossed-casings",
        "fibre-stumpfield",
        "sloughed-court"
      ]
    },
    {
      "id": "B11",
      "iteration": "R100-I12",
      "capacity": 4,
      "status": "specified",
      "worlds": [
        "crushed-seam",
        "husk-reef",
        "fibre-scree",
        "gel-rafts"
      ]
    },
    {
      "id": "B12",
      "iteration": "R100-I12",
      "capacity": 4,
      "status": "ready",
      "worlds": [
        "double-return",
        "offset-basins",
        "pinched-fan",
        "spliced-reaches"
      ]
    },
    {
      "id": "B13",
      "iteration": "R100-I12",
      "capacity": 4,
      "status": "specified",
      "worlds": [
        "white-scarfield",
        "black-lacuna",
        "ochre-folds",
        "violet-marrows"
      ]
    },
    {
      "id": "B14",
      "iteration": "R100-I12",
      "capacity": 4,
      "status": "specified",
      "worlds": [
        "fractured-estuary",
        "woven-quarters",
        "shell-patchwork",
        "last-shelf"
      ]
    }
  ],
  "generation": {
    "ordinarySeeds": [
      130150524,
      260301048,
      390451572,
      520602096,
      650752620,
      780903144,
      911053668,
      1041204192,
      1171354717,
      1301505241,
      1431655765,
      1561806289,
      1691956813,
      1822107337,
      1952257861,
      2082408385,
      2212558910,
      2342709434,
      2472859958,
      2603010482,
      2733161006,
      2863311530,
      2993462054,
      3123612578,
      3253763103,
      3383913627,
      3514064151,
      3644214675,
      3774365199,
      3904515723,
      4034666247,
      4164816771
    ],
    "boundarySeeds": [
      0,
      1,
      28,
      65535,
      65536,
      2147483647,
      4294967295,
      3390232493
    ],
    "holdout": {
      "path": "docs/qa/artifacts/r100-i07-i09/qualification-policy/holdout-seeds.json",
      "sha256": "8e70dca81d0be6650b25932951b7eeff34d0e9dfc2edaf7d166a082b917c8210",
      "seeds": [
        3924699420,
        3660982857,
        2355342267,
        4102882983,
        4051696150,
        3156191193,
        1205391731,
        447052351
      ]
    },
    "expandedHoldout": {
      "path": "docs/qa/artifacts/r100-i10-i12/expanded-holdout-seeds.json",
      "sha256": "4cb54d617579ce158ff9ce81feecab496e1a9f11e57a189ea5ed7335a871fdfd",
      "seeds": [
        3071774265,
        1415840122,
        289459498,
        475912722,
        2834021533,
        1468297279,
        54270261,
        3372297940
      ]
    },
    "newBaseCases": 8064,
    "expandedAtI11": {
      "worlds": 92,
      "cases": 2208
    },
    "expandedAtI12": {
      "worlds": 16,
      "cases": 384
    },
    "finalUniqueCases": 18144,
    "rule": "All fixed seeds recorded before execution. Failed attempts remain; exact identity retries require the same frozen executor. Authored behavior changes invalidate that world and require complete requalification."
  },
  "actualPlay": {
    "seeds": [
      20261005,
      3075192741
    ],
    "newWorldProcesses": 336,
    "inheritedWorldProcesses": 312,
    "finalUniqueProcesses": 648,
    "requirement": "Each world/grade keeps both original seed processes, with at least one actual non-entry pickup and same-run settled extraction. Empty return/death is pressure evidence, never pickup success. Original errors remain and exact retries append.",
    "controller": "tools/qa/r100-i09-journey.mjs",
    "controllerSha256": "dfde2f7429261bb81008e1f341c7e862ee6d0f71bc8c629f553b948066022bb3",
    "controllerPolicyRevision": 15,
    "storage": "docs/qa/artifacts/r100-i09/continuous-final52/earned-storage.json",
    "storageSha256": "965a98687e87690f71115472384fba50578ff9618aed328793c3a3bd1cf33b6e",
    "maximumActualPickups": 3,
    "nonEntryDistanceExclusive": 320,
    "postReturnManagement": false,
    "selection": "fixed world/grade/original seeds; no seed replacement, unchanged equipment/resources/budgets"
  },
  "continuity": {
    "baselineWorlds": 52,
    "allRecipeComparisons": 156,
    "allSurfaceComparisons": 156,
    "surfaceFields": [
      "albedo",
      "normal",
      "response",
      "emission"
    ],
    "requirement": "Exact old frozen recovery; new revision6 prior52 recipes, map/content and all four RGBA arrays identical except algorithm identity receipts. Per-world source projection and unchanged behavior dependency proof required to inherit old generation/play evidence. Changed shared behavior invalidates inheritance; compare current-to-original directly, not only transitive summaries."
  },
  "finalPool": {
    "worlds": 108,
    "grades": 324,
    "productionEntryAndColdCases": 324,
    "nodeChromiumCurrent": 324,
    "originalRevision1Fixtures": 18,
    "equivalenceTotal": 342,
    "runtimeBudget": {
      "worlds": 108,
      "grade": "severe",
      "seed": 20261004,
      "minimumAliveMs": 60000,
      "exclusive": true,
      "existingHarness": "tools/qa/check-r100-runtime-budget.mjs",
      "noProtectionFixture": true
    },
    "lifecycle": {
      "identicalRebuilds": 10,
      "mixedRebuilds": 324,
      "retainedBytesLimit": 10485760,
      "shaderCountsReviewed": true
    },
    "selection": {
      "samplesPerPolicy": 32768,
      "policies": [
        "uniform",
        "recent-history"
      ],
      "positiveProbability": true,
      "allGradesReachable": true
    }
  },
  "i11ContractMatrix": {
    "orientationsDegrees": [
      0,
      45,
      90,
      135,
      180,
      225,
      270,
      315
    ],
    "normalizedAnimationPhases": [
      0,
      0.25,
      0.5,
      0.75
    ],
    "abilitySource": {
      "path": "data/contaminant-abilities.csv",